Text,Datetime,Location,Hashtags,polarity,subjectivity
candidates upcoming byelection mp govan mbeki ward 25 da nicholaas huyssteen anc khumbulani ngema eff bandeli nkosi ifp malibongwe dlamini 2021 results 743 865 465 043,22:11:21 10:31:24,"Pretoria, South Africa","['DA', 'ANC', 'EFF', 'IFP']",0.0,0.0
results yesterdays byelection lim bela bela ward 01 vfplus 5835 3207 da 3482 3104 anc 536 053 eff 147 101 vfplus win ward da johan cloete elected,22:11:17 04:58:21,"Pretoria, South Africa","['VFPlus', 'DA', 'ANC', 'EFF']",0.8,0.4
jave saying da go anc villages gonshow could average rural votoer dont read newspaper da da election,22:11:16 16:57:13,South Africa,"['DA', 'election']",-0.075,0.19999999999999998
cape town da let water run road months ignores requests please help nevervotedda da shouldbeashamed,22:11:15 13:39:04,Pretoria ,"['nevervotedDA', 'DA', 'shouldbeashamed']",0.0,0.0
rocket science da runs municipality better anc majority voters still dont get 3rdworld culture leads thinking anc good job,22:11:15 04:27:00,South Africa,"['DA', 'ANC', '3rdworld', 'culture']",0.6,0.55
byelection candidate list 16 nov election lim bela bela ward 01 da hendrika kruger vfplus johan cloete anc bianca moco eff mahlomola mohlala 2021 results 6586 2628 483 248,22:11:13 18:03:55,"Pretoria, South Africa","['DA', 'VFplus', 'ANC', 'EFF']",0.0,0.0
agreed da voted power,22:11:11 08:41:43,johannesburg,['DA'],0.0,0.0
reelection tania campbell continuation depression many us whore unemployed living ekurhuleni da led coalition made living ekurhuleni extremely expensive unaffordable,22:11:09 07:16:29,"Gauteng, South Africa",['DA'],0.0,0.6
live reelection ekurhuleni mayor tania campbell second chance use multicoalition parties better serve residence coalitions da actionsa vf acdp ifp,22:11:09 06:54:42,"Johannesburg, South Africa","['Coalitions', 'DA', 'ActionSA', 'VF', 'ACDP', 'IFP']",0.21212121212121213,0.3333333333333333
john29 eff supporters twitter tweet like theyre affluent live white suburbs todays effs decision vote da negatively affect eff voters living ekurhuleni,22:11:08 19:13:16,"Gauteng, South Africa",['DA'],0.12159090909090907,0.4625
eff supporters excited twitter leaders voted da brought back tania campbell guess theyre either affluent live bedfordview dont live ekurhuleni da run coalition wont presiding,22:11:08 17:38:34,"Gauteng, South Africa","['DA', 'DA']",0.25954545454545447,0.54
lets forget eff abstained voting tania campbell knowing exactly results going didnt get week voted da say mind anc politicians arent ones feel brunt residents,22:11:08 17:29:24,"Gauteng, South Africa",['DA'],0.25,0.25
eff votes da back power ekurhuleni,22:11:08 13:19:26,South Africa,"['EFF', 'DA']",0.0,0.0
eff principled organisation tania campbell voted eff abstained today voted da anc wanted cogovern whereas eff wanted govern ekurhuleni alone,22:11:08 12:35:08,"Gauteng, South Africa","['EFF', 'DA']",0.0,0.0
thats eff vote da something unfortunate ekurhuleni,22:11:08 09:52:49,"Gauteng, South Africa","['EFF', 'DA']",-0.5,1.0
yoo da congratulating eff winning ward elections dont push,22:11:07 09:00:03,South Africa,"['DA', 'EFF']",0.5,0.75
da successfully retains ward 10 ethekwini municipality taking 948 vote catch happened da municipalelections,22:11:03 09:20:11,South Africa,"['DA', 'municipalelections']",0.75,0.95
results byelection 2nd november kzn ethekwini ward 10 kloof da 948 1577 anc 351 189 abc 12 117 ifp 026 045 eff 024 17 caelee laing elected councillor 311 voter turnout,22:11:03 07:14:21,"Pretoria, South Africa","['DA', 'ANC', 'ABC', 'IFP', 'EFF']",0.0,0.0
candidate list byelection 2nd november kzn ethekwini ward 10 kloof da caelee laing anc thabile zulu eff senzo mtembu ifp louisa smal abc philani mavundla 2021 party results 7903 54 194 071 003,22:11:01 08:28:41,"Pretoria, South Africa","['DA', 'ANC', 'EFF', 'IFP', 'ABC']",0.0,0.0
2024election vote southafricaelection2024 anc eff actionsa da da,22:10:27 07:12:08,"Johannesburg, South Africa","['SouthAfrica', '2024election', 'Vote', 'SouthAfricaElection2024', 'ANC', 'EFF', 'ActionSA', 'DA']",0.0,0.0
helen assume aware us vote da know anc must opposition however da still long go show viable alternative,22:10:26 18:29:22,Johannesburg,"['ANC', 'DA']",0.1,0.325
see happens highly uneducated voters abstain voting eff ekurhuleni taniacampbell da coj da natashamazzone,22:10:26 16:13:47,"Midrand, South Africa","['EFF', 'Ekurhuleni', 'TaniaCampbell', 'DA', 'COJ', 'natashamazzone']",0.16,0.5399999999999999
mphophalatse anc anc da ekurhuleni voteofnoconfidence helenzille realnewsformobile theroadto2024,22:10:26 11:02:08,"Linden, Johannesburg","['mphophalatse', 'ANC', 'ANC', 'DA', 'Ekurhuleni', 'VoteOfNoConfidence', 'HelenZille', 'RealNewsForMobile', 'TheRoadTo2024']",0.0,0.0
like smaller parties stop fighting amongst gain ground opposition failed anc need start building bridges 2024election gonna work together excluding eff da actionsa,22:10:25 08:41:07,"Cape Town, South Africa","['ANC', '2024election', 'EFF', 'DA', 'ActionSA']",-0.25,0.4
need lee khan yew type leadership political parties helping voting childish personal interest jealousy shortsighted interest support yew campaign leadership resurrection sayew anc da ff ifp eff actionsa,22:10:22 10:05:44,South Africa,"['sayew', 'anc', 'da', 'ff', 'ifp', 'eff', 'actionsa']",-0.06666666666666667,0.39999999999999997
correct phumlani need current political parties us favour voting personal interest childish powerplay think separately political parties must start champaign find one like lee yew da actionsa anc,22:10:22 09:22:48,South Africa,"['da', 'actionsa', 'anc']",-0.04,0.34
facts da voted premeditated plan clear indication da coalition approach metros disaster look da cllr voting sign council symbol da coalition partners,22:10:21 22:26:57,"Johannesburg, South Africa",['DA'],0.10000000000000002,0.3833333333333333
democratic alliance da chief whip siviwe gwarube g speaks polity coalitions legislation necessary govern ahead 2024 election watch full interview coalitions legislation da,22:10:18 09:56:43,South Africa,"['Coalitions', 'Legislation', 'DA']",0.175,0.775
country gears 2024 general elections eff westerncape currently 3 voter support ambitious plans toppling da governing province outright majority,22:10:17 18:42:17,"Johannesburg, South Africa","['EFF', 'WesternCape', 'DA']",0.10000000000000002,0.5499999999999999
zamandlovu options 1 vote da win anc 2 vote small parties coalition forms oust anc ampthey later sell anc 3 dont vote anc wins anyway 4 leave luxury smart choice,22:10:16 19:11:45,"Pretoria, ZA","['DA', 'coalition', 'Vote', 'SA']",0.21285714285714286,0.32857142857142857
type crap illustrates political parties fvcks mzansis democracy easier get power vote confidence ballot box voters damned time system reworked change asa da,22:10:16 08:56:56,South Africa,"['ASA', 'DA']",-0.4,0.45
qhabi whats deputy white stop insulting south africans personal failures nothing decide vote da got nothing silly fault dont vote anc democracy,22:10:14 15:17:38,Johannesburg,"['DA', 'ANC']",-0.375,0.54375
da bags cederberg bothasig western cape byelections da cederberg byelection,22:10:13 13:44:20,South Africa,"['DA', 'Cederberg', 'ByElection']",0.0,0.0
da leader john steenhuisen says proposals protect current coalitions believes anc fall 50 percent next elections coalition governments formed ld,22:10:13 09:34:02,South Africa,['DA'],0.0,0.2
da opposition outlining proposals legislate coalitions preparation 2024 elections ld,22:10:13 09:30:17,South Africa,['DA'],0.0,0.0
results byelection held wc city cape town ward 05 da 9226 429 acdp 746 478 eff 016 055 ara 012 011 da win ward miquette temlett elected,22:10:13 08:06:21,"Pretoria, South Africa","['DA', 'ACDP', 'EFF', 'ARA']",0.8,0.4
results byelection held wc cederberg ward 05 da 4574 28 pa 3329 2494 anc 209 462 eff 006 008 da win ward john hayes elected,22:10:13 08:01:52,"Pretoria, South Africa","['DA', 'PA', 'ANC', 'EFF']",0.8,0.4
anc really working destroying main opposition parties using spvs fly nights dont like da yet one fails see anc using spvs ahead 2024election never defeat anc rid corruption,22:10:12 09:43:11,"Johannesburg, South Africa","['ANC', 'DA', 'ANC', '2024election', 'ANC']",0.09333333333333334,0.3466666666666667
many vote da leave frustration dont change votes,22:10:11 05:53:21,South Africa,['DA'],0.5,0.5
candidates upcoming byelection 12th october wc city cape town ward 05 da miquette temlett acdp karin verschoor eff motlatso maunatlala ara shana october 2021 party results 8797 268 071 001,22:10:10 05:00:00,"Pretoria, South Africa","['DA', 'ACDP', 'EFF', 'ARA']",0.0,0.0
candidates upcoming byelection 12th september wc cederberg ward 05 da john hayes anc beverly van der heeverschalk pa william farmer eff ferdienand fransman 2021 party results 4294 2552 835 014,22:10:10 05:00:00,"Pretoria, South Africa","['DA', 'ANC', 'PA', 'EFF']",0.0,0.0
options 1 vote da win anc 2 vote others coalition forms oust anc ampthey later sell anc 3 dont vote anc wins anyway 4 leave luxury smart choice option 1 better country,22:10:07 08:34:31,"Pretoria, ZA","['DA', 'coalition', 'Vote', 'SA']",0.3628571428571429,0.3485714285714286
kunene vote one enough send anc opposition benches ekurhuleni currently failed da coalition,22:10:06 17:19:02,"Gauteng, South Africa",['DA'],-0.25,0.4
anc minority parties helped collapse joburgpoliticalcoalition hoping banging old da arrogant da racist drum get savoters overlook forget anc parties campaigned back,22:10:04 06:45:28,"Cape Town, South Africa","['ANC', 'JoburgPoliticalCoalition', 'DA', 'SAVoters']",0.05,0.1
honestly speaking mostly due choices make keep giving votes people hate da da abusing missing coloured votes along coloured communities nothing show votes whose fault,22:10:02 20:35:19,South Africa,"['DA', 'coloured']",-0.13125000000000003,0.5562499999999999
exactly somewhere last year last council da installed generators short removed water water reoccurring issue care votes count,22:10:01 19:57:07,"Johannesburg, South Africa","['council', 'DA']",0.0625,0.17083333333333334
press da da set former mayor fail clip political wings intransigence scupper negotiations abstention confidence vote scorned former coalition partners,22:10:01 18:46:55,South Africa,['DA'],-0.125,0.09999999999999998
vote da go,22:10:01 09:49:07,"Pretoria, ZA",['DA'],0.0,0.0
da cant win election nerve full entitled political parties vote,22:09:30 20:33:42,"Durban, South Africa",['DA'],0.3833333333333333,0.35000000000000003
stop wasting courts time return drawing board repackage da effectively capture collective imagination voters welfare remember da epitomizes law diminishing returns money pumped da less votes get,22:09:30 17:36:28,"Horison View, South Africa",['DA'],0.21666666666666667,0.43333333333333335
cleverblacks vote 4 da dare phoenixmassacre,22:09:30 05:11:21,"Durban, South Africa","['CleverBlacks', 'DA', 'PhoenixMassacre']",0.0,0.0
da must always remember sharing caring voteofnoconfidence daout democraticalliance da handsoffjoburg,22:09:29 18:22:34,Bloemfontein,"['VoteOfNoConfidence', 'DAOut', 'DemocraticAlliance', 'DA', 'HandsOffJoburg']",0.0,0.0
22 matter issue matter problem frequent rate need justify result remains taps dry happy da joburgcouncil deliver excuses gain votes remember,22:09:29 15:57:30,"Johannesburg, South Africa","['DA', 'JoburgCouncil']",0.2777777777777778,0.6333333333333333
jones destruction da da work win majority votes stop white supremacy entitlement complex,22:09:29 14:42:36,South Africa,['DA'],0.16666666666666666,0.26666666666666666
interesting vote collen makhubele cope voted speaker city joburg da candidate alex christians lost 129 141,22:09:28 15:17:27,"Umhlanga, South Africa","['COPE', 'DA']",0.5,0.5
schreib choice believe baseless claims white people plunging us back apartheid cannot happen globally recognised crime humanity vote da better track record excellent service delivery well done wc da,22:09:24 02:18:18,"Johannesburg, South Africa",['DA'],0.3,0.3
choice believe baseless claims white people plunging us back apartheid cannot happen globally recognised crime humanity vote da better track record excellent service delivery well done wc da,22:09:24 02:18:04,"Johannesburg, South Africa",['DA'],0.3,0.3
jhb like im concerned da stance promoting failed vaccine many many voters clarify stance driving agenda definately latest science data released,22:09:22 14:09:19,"Cape Town, South Africa","['DA', 'vaccine']",0.25,0.55
made bed lie anc intellectuals enjoy fruits representative positions vote criminal empire youall hate da one reason youre shyte scared weighed non quota peersmenimenitekelupharsin,22:09:21 07:27:28,South Africa,"['ANC', 'representative', 'DA', 'MeniMeniTekelUpharsin']",-0.26666666666666666,0.65
im voting patrioticalliancenever vote racists da photocopy actionsa dont bother mentioning anc,22:09:20 10:10:10,Soweto,"['PatrioticAlliance', 'DA', 'ActionSA']",0.0,0.0
pity good opposition vote anc split decent brain cell could see concentrating opposition vote da best right thing might something good hold work,22:09:20 06:48:02,South Africa,"['ANC', 'da']",0.4587301587301587,0.4837301587301588
jabulani apartheid whites continue making look better try see da afriforum wins elections whites good dividing black people da must rent black people protest im member good standing eff,22:09:19 19:34:08,"Gauteng, South Africa","['DA', 'Afriforum', 'DA']",0.31111111111111106,0.4611111111111112
2024 let vote party well show anc da eff seen take us anywhere like political party,22:09:19 11:01:20,"Durban, South Africa","['anc', 'DA', 'eff']",0.0,0.1
still dont credible political leadership vote 2024 anc eff da actionsa maybe gaytonmakhenzi pa bit promising,22:09:18 19:52:00,"Atteridgeville, South Africa","['ANC', 'EFF', 'DA', 'ACTIONSA', 'GaytonMakhenzi', 'PA']",0.20000000000000004,0.4333333333333333
abt give voters background eff ok stunts last time worked u run jhb u moved lot people ward58 wards u gave buildings whites jhb people sleep parks hijacked ward councillors da,22:09:18 11:11:21,"Johannesburg, South Africa","['EFF', 'DA']",0.25,0.2833333333333333
stage10 come2024 difficult vote da 2024election,22:09:18 09:52:31,South Africa,"['Stage10', 'come2024', 'DA', '2024Election']",-0.5,1.0
think bit disrespectful black south africans say single issue voters would 18yr old ivory parktembisa vote da actionsa actually alternative eff ground,22:09:18 07:37:56,"kalibab, Midrand","['DA', 'ACTIONSA', 'EFF']",-0.03452380952380952,0.23690476190476192
results byelection held wc prince albert ward 04 da 506 2108 kgp 4849 1731 ara 058 eff 034 151 da win ward kgp magrietha jaftha elected,22:09:16 20:40:46,"Pretoria, South Africa","['DA', 'KGP', 'ARA', 'EFF']",0.8,0.4
sibanye ceo outlier among business leaders pref via politically correct getting us nowhere anc acdp da get gear running time country acdp vote,22:09:16 09:46:10,"Johannesburg, South Africa","['ANC', 'ACDP', 'DA']",0.0,0.1
bra vote go patrioticalliance ffplusnever effdaactionsa forget ancyes want land back need seal boarders first,22:09:15 07:56:11,Soweto,"['PatrioticAlliance', 'FFPlus', 'EFF', 'DA', 'ACTIONSA', 'ANC']",0.125,0.16666666666666666
candidates upcoming byelection 12th september wc prince albert ward 04 kgp goliat lottering da magrietha jaftha eff johnny hendricks ara edward hattingh 2021 party results 3118 2952 185 na,22:09:12 06:11:59,"Pretoria, South Africa","['KGP', 'DA', 'EFF', 'ARA']",0.0,0.0
power failure preloadshedding hilton calls reporting line hold 15 mins dropped probably notice need faults team till 10am loadshedding ends voted da municip,22:09:10 06:26:45,Johannesburg,['DA'],-0.3166666666666667,0.3
votes morons oh yes entire country durban da sat posterior voted slice conniving anc small parties cest la tender lesson never bring knife gun fight end active citizenry turn around,22:09:06 00:39:58,"Durban, South Africa","['Durban', 'DA', 'ANC']",-0.29583333333333334,0.65625
dont understand 5 coalition parties 1st place allowed da didnt win elections mayor speaker never happened negotiators failed da,22:09:05 08:50:58,"Pearly Beach, South Africa",['DA'],0.15000000000000002,0.35
anc hates sans eff hates sans da hates sans vote lets make sure show parties middle finger,22:09:03 05:52:05,South Africa,"['ANC', 'EFF', 'DA']",0.25,0.4444444444444444
sharing south african voting regional counselor think hellen zille someone admire know making racist statements vote party da putsouthaficansfirst time change tshwane needs help,22:09:02 17:19:32,South Africa,"['DA', 'PutSouthAficansFirst']",0.0,0.0
results byelection held nc sol plaatje ward 21 da 5887 658 anc 208 922 vfplus 146 048 eff 518 015 da win ward jamie greef elected,22:09:01 10:29:29,"Pretoria, South Africa","['DA', 'ANC', 'VFplus', 'EFF']",0.8,0.4
anc took control knysna wednesday daled coalition lost power councillors passed vote confidence mayor levael davis deputy mark willemse knysna anc da algoafmnews politics,22:08:31 15:53:23,"Gqeberha, South Africa","['Knysna', 'ANC', 'DA', 'AlgoaFMNews', 'politics']",0.0,0.0
mangena star cartoon da election24 patriciakopane andrewlouw makashulegana,22:08:30 16:18:00,"Bellville, South Africa","['cartoon', 'DA', 'election24', 'PatriciaKopane', 'AndrewLouw', 'MakashuleGana']",0.0,0.0
breaking news recent poll conducted independent body revealed 2024 elections anc receive 43 total votes followed eff 35 da 13 ifp 2 others share remaining 7 based 98 accuracy,22:08:29 07:57:50,"Durban, South Africa","['ANC', 'EFF', 'DA', 'IFP']",0.0,0.375
good parties showing us really eff da notes voting,22:08:25 10:23:23,South Africa,"['EFF', 'DA']",0.44999999999999996,0.4
go tshwane see waste land became da ruling bloody useless anc green water forget clean bins weekly etc list problems growing daily voting da like voting anc,22:08:22 20:46:46,South Africa,"['DA', 'DA']",-0.2222222222222222,0.35000000000000003
candidates upcoming byelection 31th august nc sol plaatje ward 21 da jamielee greeff vfplus johan griesel anc ranolang tokgwi eff selebogo 2021 party results 5229 1412 1158 533,22:08:21 09:18:24,"Pretoria, South Africa","['DA', 'VFplus', 'ANC', 'EFF']",0.0,0.0
anc da form grand coalition 2024 election lester kiewit interviews political journalist janjan joubert,22:08:16 18:41:00,"Cape Town, South Africa","['ANC', 'DA']",0.25,0.55
anc da form grand coalition 2024 election,22:08:16 12:38:01,"Cape Town, South Africa","['ANC', 'DA']",0.5,1.0
da resignation black leaders farce every left da formed organization give support back da see musi mashaba gana form party da strategy give support garner back da strategy garner votes,22:08:07 10:24:19,"Pretoria, South Africa",['DA'],-0.11333333333333333,0.18666666666666668
da realised dont beg blacks votes blacks actually ones begging vote party da everything satisfy interests white people thats constituency abantu abamnyama bayazifaka bengafunwa kwada,22:08:04 19:14:58,"Durban, South Africa","['DA', 'DA']",0.0,0.05
voting anc hows udm perhaps 2023 faced questions multiple answers zamazamas mohaleotr makashule da,22:08:04 09:23:49,Soweto ,"['ANC', 'UDM', 'ZamaZamas', 'MohaleOTR', 'makashule', 'DA']",0.0,0.0
results byelection held limpopo modimollemookgophong ward 12 da 6831 365 vf 2997 626 anc 089 202 eff 084 02 da win ward wiets botes elected,22:08:04 05:09:59,"Pretoria, South Africa","['DA', 'VF', 'ANC', 'EFF']",0.8,0.4
results byelection held gp tshwane ward 42 da 7755 557 vf 1931 702 anc 251 402 eff 051 058 rc 012 06 da win ward shame maas elected,22:08:04 05:04:11,"Pretoria, South Africa","['DA', 'VF', 'ANC', 'EFF', 'RC']",0.8,0.4
candidates upcoming byelection 3rd august limpopo modimollemookgophong ward 12 da wiets botes vf mariska greyling anc thabiso makanatleng eff dinah lechelelele 2021 party results 7196 2371 291 064,22:08:02 19:59:58,"Pretoria, South Africa","['DA', 'VF', 'ANC', 'EFF']",0.0,0.0
candidates upcoming byelection 3rd august gp tshwane ward 42 da shane maas vf daniel laas anc tshehofatso chauke eff jozias mahube rc paul joubert 2021 party results 7198 1229 653 109 006,22:08:02 19:45:00,"Pretoria, South Africa","['DA', 'VF', 'ANC', 'EFF', 'RC']",0.0,0.0
tembisa tembisashutdown da results voting anc tembisa da led coalition increased tarrifsscrapped indemnity tarrifs da u say u say opposition,22:08:01 08:13:54,South Africa,"['Tembisa', 'Tembisashutdown', 'DA']",0.0,0.0
results byelection held kzn umdoni ward 13 anc 2945 51 eff 2368 714 da 1711 992 aljama 1523 324 ifp 921 745 am4c 44 953 pfp 09 073 dfa 1 vote anc gain da ravinand maharaj elected,22:07:28 10:59:33,"Pretoria, South Africa","['ANC', 'EFF', 'DA', 'ALJAMA', 'IFP', 'AM4C', 'PFP', 'DFA']",0.0,0.0
kzn remind people last two locals election da govern trough coalition expect western cape almost municipality still far away scare anc,22:07:24 15:09:35,"Durban, South Africa","['DA', 'ANC']",0.03333333333333333,0.35555555555555557
rescheduled kzn umdoni ward 13 byelection party candidate list da saleem mahomed anc ravinand maharaj eff mhlengi radebe ifp jabulane mvubu aljama muhammad khan am4c royith bhoola pfp razak moulasa dfa david fourie election set 27 july,22:07:19 08:20:25,"Pretoria, South Africa","['DA', 'ANC', 'EFF', 'IFP', 'AlJama', 'AM4C', 'PFP', 'DFA']",0.0,0.0
byelections da wins ward patriotic alliance matzikama anc retains ward nelson mandela bay byelection da pa anc nmb,22:07:07 12:02:32,South Africa,"['ByElection', 'DA', 'PA', 'ANC', 'NMB']",0.3,0.2
results byelection held wc matzikama ward 07 da 6227 3979 anc 3157 93 pa 56 2141 eff 056 109 da gain ward pa christo boks former pa councilor wins ward,22:07:07 05:35:54,"Pretoria, South Africa","['DA', 'ANC', 'PA', 'EFF']",0.15,0.1
uzalo sabc1 vikizithamagwaza da voted still unemployed da youre useless yazi useless thieves stealing holland think coloureds cape flats useless white nonsense bloody killers,22:07:06 18:54:24,"Bloemfontein, South Africa","['Uzalo', 'VikizithaMagwaza', 'DA', 'Holland']",-0.45999999999999996,0.3
bought original poster 1994 zach de beer leader democratic party democratic alliance da zach de beer lost nelson mandela 1994 elections schreib da dp history politics zachdebeer,22:07:04 03:30:26,"Johannesburg, South Africa","['DA', 'DP', 'history', 'politics', 'ZachDeBeer']",0.375,0.75
msm partly responsible dire situation finds attack well governed da turn possible black voters away racist one sided reporting see trashy reporting sells newspapers sies msm,22:07:02 05:49:07,"Cape Town, South Africa","['MSM', 'SouthAfrica', 'DA', 'racist', 'MSM']",0.011111111111111118,0.6611111111111111
candidate upcoming byelection 6th june wc matzikama ward 07 pa rodney lakay da christo boks anc hazel daniels eff desmond pula 2021 party results 2701 2248 2227 165,22:07:01 10:19:32,"Pretoria, South Africa","['PA', 'DA', 'ANC', 'EFF']",0.0,0.0
number candidates per party upcoming 6th june byelections anc 4 eff 4 da 1 pa 1 actionsa 1 ifp 1 excluding small regional parties,22:07:01 10:10:01,"Pretoria, South Africa","['ANC', 'EFF', 'DA', 'PA', 'ActionSA', 'IFP']",-0.25,0.4
time south africans accountable change time youth voted power real change led people care future eskom enoughisenough anc da eff cyrilramaphosa,22:06:29 05:49:42,"Randfontein, South Africa","['Eskom', 'EnoughIsEnough', 'ANC', 'DA', 'EFF', 'CyrilRamaphosa']",0.1,0.21250000000000002
sane person votes incompetent anc comrades needs go lobotomy valid reason earth da actionsa planning increasing social grants tell everyone,22:06:28 15:23:43,"Cape Town, South Africa ","['da', 'actionsa']",-0.15833333333333333,0.21666666666666667
sas chances survival slim anc remains power beyond 2024 elections steenhuisen anc da johnsteenhuisen,22:06:28 12:41:03,South Africa,"['ANC', 'DA', 'JohnSteenhuisen']",0.0,0.0
anc responds da win kzn heartland mafia lose national election inevitable consequence ancs use politicalmurder tactic deal competition,22:06:24 22:07:15,"Cape Town, South Africa","['ANC', 'DA', 'KZN', 'mafia', 'PoliticalMurder']",0.4,0.7
attempt pass buck matter getting heads buck american interference law enforcement win votes da,22:06:23 07:05:28,Johannesburg,['DA'],0.4,0.2
da da lost vote asking fbi intervene farmgate totally overkill trying prove,22:06:21 13:49:40,South Africa,['DA'],0.0,0.75
im bashing da victor warning remain silent dangers vaccine children anybody matter lose many voters wakeup,22:06:20 21:24:46,"Cape Town, South Africa","['DA', 'vaccine', 'WakeUp']",0.25,0.3
da still pushing vaccines kids wc schools big mistake lose many votes know damage causing vaccineinjured vaccinedeaths look around warn friends efore late,22:06:20 20:48:36,"Cape Town, South Africa","['DA', 'vaccines', 'VaccineInjured', 'VaccineDeaths']",0.06666666666666667,0.39999999999999997
honestly think iq test used determine able vote south africa people still supporting zuma shit open eyes maby come visit ct see province run zuma anc da,22:06:18 06:58:22,"Cape Town, South Africa","['zuma', 'anc', 'DA']",0.23000000000000004,0.615
respect nothing learn da anyone anyone learning mazzone co deserve vote voetsekda,22:06:11 11:04:32,South Africa,"['DA', 'VoetsekDA']",0.0,0.0
visual representation gauteng election results years party provincial premier come 2024 vote poll comments anc da eff actionsa,22:06:03 08:57:36,"Pretoria, South Africa","['ANC', 'DA', 'EFF', 'actionSA']",0.0,0.0
anc loses wards eff da byelections holds onto soweto ward thread anc da eff byelection soweto,22:06:02 12:27:57,South Africa,"['ANC', 'DA', 'EFF', 'ByElection', 'Soweto']",-0.3,0.1
results 1st june byelection held nc kareeberg ward 04 da 4277 286 anc 3259 122 eff 1976 19 kcm 428 2068 pa 061 anc loose seat da johan vermeulen elected,22:06:02 06:04:18,"Pretoria, South Africa","['DA', 'ANC', 'EFF', 'KCM', 'PA']",-0.07692307692307693,0.2692307692307692
